{
  "$schema": "http://json-schema.org/draft-07/schema#",
  "type": "object",
  "properties": {
    "id": {
      "type": "string"
    },
    "name": {
      "type": "string"
    },
    "details": {
      "type": "string"
    },
    "link": {
      "type": "string"
    },
    "kind": {
      "type": "string",
      "enum": ["Personal", "Contract", "Full-time"]
    },
    "period": {
      "type": "string"
    },
    "roles": {
      "type": "array",
      "items": {
        "type": "string"
      }
    },
    "tools": {
      "type": "array",
      "items": {
        "type": "string"
      }
    },
    "wip": {
      "type": "boolean",
      "optional": true
    },
    "git": {
      "type": "string",
      "optional": true
    },
    "credits": {
      "type": "array",
      "items": {
        "type": "object",
        "properties": {
          "name": {
            "type": "string"
          },
          "link": {
            "type": "string"
          }
        },
        "required": ["name", "link"]
      },
      "optional": true
    }
  },
  "required": ["id", "name", "details", "link", "kind", "period", "roles", "tools"]
}
