{
  "id": "human-v0",
  "wip": true,
  "name": "Human v0",
  "details": "The first public version of my website/portfolio. A minimalist dark-mode design inspired by bold grotesque grids, and towering skyscrapers.",
  "kind": "Full-time",
  "link": "https://ijkml.vercel.app",
  "period": "2015 - Present",
  "roles": ["Designer", "Developer"],
  "tools": ["Vue/TS", "Nuxt", "Uno/Sass", "Nuxt Studio"],
  "git": "https://github.com/ijkml/human",
  "credits": [{
    "name": "Design inspiration â€” Bequant",
    "link": "https://www.bequant.com/"
  }]
}
