{
  "id": "voe",
  "name": "Voe",
  "details": "Voe is a responsive demo of Egbo Prosper's Voe Airport landing page (pun unintened). The website features a sleek dark mode and GPT-translation in 5 languages: English, Spanish, French, Japanese, and Chinese).",
  "kind": "Personal",
  "period": "Nov 2022 - Jan 2023",
  "link": "https://voey.netlify.app/",
  "roles": ["Developer"],
  "tools": [
    "Vue/TS",
    "Nuxt",
    "Nuxt i18n",
    "Uno/Sass",
    "Headless UI",
    "Iconify"
  ],
  "git": "https://github.com/ijkml/Voe",
  "credits": [
    {
      "name": "Egbo Prosper (Design)",
      "link": "https://www.behance.net/gallery/156009795/Voe-_-Landing-page-UI-design"
    }
  ]
}
